{
  "id": "motorcycle-common",
  "meta": {
    "make": "_base",
    "model": "Motorcycle Common",
    "author": "abrahdev",
    "version": "1.0.0"
  },
  "parts": [
    {
      "id": "chain-lube",
      "name": "Chain lubricant",
      "i18n_key": "part_chain_lube",
      "quantity": 1,
      "unit": "can"
    },
    {
      "id": "brake-pad-set",
      "name": "Brake pads (set)",
      "i18n_key": "part_brake_pads",
      "quantity": 2,
      "unit": "set"
    },
    {
      "id": "brake-fluid",
      "name": "Brake fluid",
      "i18n_key": "part_brake_fluid",
      "quantity": 0.5,
      "unit": "L"
    },
    {
      "id": "fork-oil",
      "name": "Fork oil",
      "i18n_key": "part_fork_oil",
      "quantity": 1,
      "unit": "L"
    }
  ],
  "maintenance_items": [
    {
      "id": "chain",
      "label": "Chain (Clean and lube)",
      "i18n_key": "seed_interval_chain",
      "desc_i18n_key": "seed_desc_chain",
      "interval_km": 1000,
      "parts": [
        {
          "part_id": "chain-lube",
          "quantity": 1
        }
      ],
      "description": "The chain is the component that suffers the most wear. Regular lubrication extends its life and prevents dangerous breakage."
    },
    {
      "id": "brake-pads",
      "label": "Brake pads",
      "i18n_key": "seed_interval_brake_pads",
      "desc_i18n_key": "seed_desc_motorcycle_brake_pads",
      "interval_km": 5000,
      "interval_months": 6,
      "parts": [
        {
          "part_id": "brake-pad-set",
          "quantity": 2
        }
      ],
      "description": "Friction compound wears with use. Below 1.5mm thickness, safety is compromised."
    },
    {
      "id": "brake-fluid",
      "label": "Brake fluid",
      "i18n_key": "seed_interval_brake_fluid",
      "desc_i18n_key": "seed_desc_brake_fluid",
      "interval_km": 20000,
      "interval_months": 24,
      "parts": [
        {
          "part_id": "brake-fluid",
          "quantity": 0.5
        }
      ],
      "description": "Brake fluid is hygroscopic: it absorbs moisture, reducing its boiling point and braking effectiveness."
    },
    {
      "id": "tire-pressure",
      "label": "Tire pressure and condition",
      "i18n_key": "seed_interval_tire_pressure",
      "desc_i18n_key": "seed_desc_tires",
      "interval_km": 1000,
      "description": "Tires degrade both by mileage and age. Incorrect pressure or uneven wear compromises grip and safety."
    },
    {
      "id": "fork-oil",
      "label": "Fork oil",
      "i18n_key": "seed_interval_fork_oil",
      "desc_i18n_key": "seed_desc_fork_oil",
      "interval_km": 15000,
      "interval_months": 36,
      "parts": [
        {
          "part_id": "fork-oil",
          "quantity": 1
        }
      ],
      "description": "Over time it breaks down, losing density and worsening front suspension behavior."
    },
    {
      "id": "chassis-bearings",
      "label": "Chassis & wheel bearings",
      "i18n_key": "seed_interval_chassis_bearings",
      "desc_i18n_key": "seed_desc_chassis_bearings",
      "interval_km": 10000,
      "interval_months": 12,
      "description": "Check for play or roughness in wheel hubs, steering head bearings, and swingarm pivot."
    },
    {
      "id": "cables-controls",
      "label": "Cables & controls",
      "i18n_key": "seed_interval_cables_controls",
      "desc_i18n_key": "seed_desc_cables_controls",
      "interval_km": 5000,
      "interval_months": 6,
      "description": "Lubricate clutch and throttle cables. Verify correct free play on levers and pedals."
    }
  ]
}
