{
  "id": "combustion",
  "extends": [
    "_base/car-common.json"
  ],
  "meta": {
    "make": "_base",
    "model": "Combustion engine (gasoline & diesel)",
    "author": "abrahdev",
    "version": "1.0.0"
  },
  "parts": [
    {
      "id": "engine-oil",
      "name": "Engine oil",
      "i18n_key": "part_engine_oil",
      "quantity": 5,
      "unit": "L"
    },
    {
      "id": "oil-filter",
      "name": "Oil filter",
      "i18n_key": "part_oil_filter",
      "quantity": 1,
      "unit": "unit"
    },
    {
      "id": "air-filter",
      "name": "Air filter",
      "i18n_key": "part_air_filter",
      "quantity": 1,
      "unit": "unit"
    },
    {
      "id": "spark-plug",
      "name": "Spark plug",
      "i18n_key": "part_spark_plug",
      "quantity": 4,
      "unit": "unit"
    },
    {
      "id": "timing-belt",
      "name": "Timing belt",
      "i18n_key": "part_timing_belt",
      "quantity": 1,
      "unit": "unit"
    }
  ],
  "maintenance_items": [
    {
      "id": "oil-change",
      "label": "Oil change",
      "i18n_key": "seed_interval_oil_change",
      "desc_i18n_key": "seed_desc_oil_change",
      "interval_km": 10000,
      "interval_months": 12,
      "parts": [
        {
          "part_id": "engine-oil",
          "quantity": 5
        },
        {
          "part_id": "oil-filter",
          "quantity": 1
        }
      ],
      "description": "Oil loses its lubricating properties with mileage and time. Regular changes protect the engine from premature wear."
    },
    {
      "id": "oil-filter",
      "label": "Oil filter",
      "i18n_key": "seed_interval_oil_filter",
      "desc_i18n_key": "seed_desc_oil_filter",
      "interval_km": 10000,
      "interval_months": 12,
      "parts": [
        {
          "part_id": "oil-filter",
          "quantity": 1
        }
      ],
      "description": "The oil filter traps particles and contaminants. If saturated, oil circulates unfiltered and accelerates engine wear."
    },
    {
      "id": "air-filter",
      "label": "Air filter",
      "i18n_key": "seed_interval_air_filter",
      "desc_i18n_key": "seed_desc_air_filter",
      "interval_km": 20000,
      "parts": [
        {
          "part_id": "air-filter",
          "quantity": 1
        }
      ],
      "description": "A dirty air filter reduces power, increases consumption, and can damage intake sensors."
    },
    {
      "id": "spark-plugs",
      "label": "Spark plugs",
      "i18n_key": "seed_interval_spark_plugs",
      "desc_i18n_key": "seed_desc_spark_plugs",
      "interval_km": 40000,
      "parts": [
        {
          "part_id": "spark-plug",
          "quantity": 4
        }
      ],
      "description": "Worn spark plugs increase consumption, make starting difficult, and can damage the ignition coil."
    },
    {
      "id": "timing-belt",
      "label": "Timing belt",
      "i18n_key": "seed_interval_timing_belt",
      "desc_i18n_key": "seed_desc_timing_belt",
      "interval_km": 100000,
      "interval_months": 60,
      "parts": [
        {
          "part_id": "timing-belt",
          "quantity": 1
        }
      ],
      "description": "The timing belt is critical: if it breaks, the engine suffers severe damage. It must be changed at the manufacturer's interval without exception."
    }
  ]
}
