{
  "id": "electric",
  "extends": [
    "_base/car-common.json"
  ],
  "meta": {
    "make": "_base",
    "model": "Electric vehicle",
    "author": "abrahdev",
    "version": "1.0.0"
  },
  "parts": [
    {
      "id": "battery-coolant",
      "name": "Battery coolant",
      "i18n_key": "part_battery_coolant",
      "quantity": 1,
      "unit": "L"
    },
    {
      "id": "inverter-coolant",
      "name": "Inverter / motor coolant",
      "i18n_key": "part_inverter_coolant",
      "quantity": 2,
      "unit": "L"
    },
    {
      "id": "drive-unit-oil",
      "name": "Drive unit oil",
      "i18n_key": "part_drive_unit_oil",
      "quantity": 1,
      "unit": "L"
    }
  ],
  "maintenance_items": [
    {
      "id": "brake-pads",
      "interval_km": 50000,
      "description": "EVs use regenerative braking, so friction brakes wear much slower. Still, inspect annually for corrosion."
    },
    {
      "id": "battery-cooling",
      "label": "Battery cooling system",
      "i18n_key": "seed_interval_battery_cooling",
      "desc_i18n_key": "seed_desc_battery_cooling",
      "interval_km": 60000,
      "parts": [
        {
          "part_id": "battery-coolant",
          "quantity": 1
        }
      ],
      "description": "The battery cooling system is vital for maintaining optimal temperature and prolonging cell life."
    },
    {
      "id": "inverter-coolant",
      "label": "Inverter / motor coolant",
      "i18n_key": "seed_interval_inverter_coolant",
      "desc_i18n_key": "seed_desc_inverter_coolant",
      "interval_km": 80000,
      "interval_months": 36,
      "parts": [
        {
          "part_id": "inverter-coolant",
          "quantity": 2
        }
      ],
      "description": "The power electronics and electric motor generate heat. Coolant prevents overheating and component failure."
    },
    {
      "id": "drive-unit-oil",
      "label": "Drive unit oil",
      "i18n_key": "seed_interval_drive_unit_oil",
      "desc_i18n_key": "seed_desc_drive_unit_oil",
      "interval_km": 100000,
      "parts": [
        {
          "part_id": "drive-unit-oil",
          "quantity": 1
        }
      ],
      "description": "The reduction gear in the drive unit has its own oil. Change intervals vary by manufacturer."
    },
    {
      "id": "cabin-filter",
      "interval_km": 15000,
      "description": "EVs recirculate cabin air more frequently. Replace sooner for better air quality, especially with climate control use."
    }
  ]
}
